{
  "kind": "observation",
  "schema_version": "1.0.0",
  "observation_id": "obs_0002",
  "entity_key": "ent_ck_78",
  "attribute_key": "attr_pages_food_30d",
  "value_state": "unobserved",
  "unit_of_measure": "count",
  "observed_at": "2026-09-30T00:00:00Z",
  "available_at": "2026-09-30T02:00:00Z",
  "evidence_kind": "observed",
  "source_dataset_ref": {
    "id": "ds_web_demo",
    "version": "1.0.0"
  },
  "observation_context_ref": null
}
